[
  {
    "id": "mercury.surface_temp",
    "worldId": "mercury",
    "label": "Температура поверхности (день и ночь)",
    "display": "от −180 до +430 °C",
    "value": null,
    "unit": "°C",
    "uncertainty": null,
    "confidence": "measured",
    "howWeKnow": {
      "summary": "Днём камни Меркурия нагреваются примерно до +430 °C, а ночью остывают до −180 °C: воздуха, который удержал бы тепло, нет. Первые замеры тепла сделали с Земли инфракрасными приборами — они улавливают тепловое излучение — и с пролётного аппарата «Маринер-10» в 1974–1975 годах. Зонд MESSENGER на орбите (2011–2015) уточнил картину, а к Меркурию летит BepiColombo.",
      "missionIds": [
        "mariner10",
        "messenger",
        "bepicolombo"
      ],
      "methodIds": [
        "ir_radiometry"
      ],
      "year": 1974
    },
    "source": {
      "title": "Mercury: Facts",
      "org": "NASA Science",
      "url": "https://science.nasa.gov/mercury/facts/"
    },
    "lastVerified": "2026-10-04",
    "verifiedBy": "agent"
  },
  {
    "id": "mercury.gravity",
    "worldId": "mercury",
    "label": "Сила тяжести",
    "display": "0,38 g",
    "value": 0.38,
    "unit": "g",
    "uncertainty": null,
    "confidence": "derived",
    "howWeKnow": {
      "summary": "Массу Меркурия узнали по тому, как его притяжение искривило путь пролетавших мимо аппаратов «Маринер-10» и MESSENGER. Зная массу и размер планеты, вычисляют силу тяжести на поверхности: 3,70 м/с², это 0,38 земной.",
      "missionIds": [
        "mariner10",
        "messenger"
      ],
      "methodIds": [
        "radio_science"
      ],
      "year": 2011
    },
    "source": {
      "title": "Mercury Fact Sheet",
      "org": "NASA NSSDCA",
      "url": "https://nssdc.gsfc.nasa.gov/planetary/factsheet/mercuryfact.html"
    },
    "lastVerified": "2026-10-04",
    "verifiedBy": "agent"
  },
  {
    "id": "mercury.day",
    "worldId": "mercury",
    "label": "Солнечные сутки (от полудня до полудня)",
    "display": "176 земных суток",
    "value": 175.94,
    "unit": "Earth days",
    "uncertainty": null,
    "confidence": "measured",
    "howWeKnow": {
      "summary": "Меркурий поворачивается вокруг оси за 59 земных суток, но одновременно быстро бежит вокруг Солнца. Поэтому от одного полудня до следующего проходит около 176 земных суток — дольше, чем его год (88 суток). Вращение измерили радаром с Земли и уточнили по снимкам космических аппаратов.",
      "missionIds": [
        "mariner10",
        "messenger"
      ],
      "methodIds": [
        "radar"
      ],
      "year": null
    },
    "source": {
      "title": "Mercury Fact Sheet",
      "org": "NASA NSSDCA",
      "url": "https://nssdc.gsfc.nasa.gov/planetary/factsheet/mercuryfact.html"
    },
    "lastVerified": "2026-10-04",
    "verifiedBy": "agent"
  },
  {
    "id": "mercury.atmosphere",
    "worldId": "mercury",
    "label": "Атмосфера",
    "display": "Почти нет (экзосфера)",
    "value": null,
    "unit": null,
    "uncertainty": null,
    "confidence": "measured",
    "howWeKnow": {
      "summary": "Настоящей атмосферы у Меркурия нет — только экзосфера: редкие атомы кислорода, натрия, водорода, гелия и калия, выбитые с поверхности солнечным ветром и ударами метеоритов. Их состав определяли по спектрам — «отпечаткам» света разных веществ — с «Маринера-10» и MESSENGER.",
      "missionIds": [
        "mariner10",
        "messenger"
      ],
      "methodIds": [
        "spectroscopy"
      ],
      "year": 1974
    },
    "source": {
      "title": "Mercury: Facts",
      "org": "NASA Science",
      "url": "https://science.nasa.gov/mercury/facts/"
    },
    "lastVerified": "2026-10-04",
    "verifiedBy": "agent"
  },
  {
    "id": "mercury.pressure",
    "worldId": "mercury",
    "label": "Давление у поверхности",
    "display": "≈0",
    "value": 5e-15,
    "unit": "bar",
    "uncertainty": null,
    "confidence": "estimated",
    "howWeKnow": {
      "summary": "Давление экзосферы Меркурия меньше примерно пяти тысяч триллионных долей бара — это почти идеальная пустота, лучше, чем в большинстве земных вакуумных камер. Такая оценка получена из измерений количества атомов над поверхностью.",
      "missionIds": [
        "mariner10",
        "messenger"
      ],
      "methodIds": [
        "spectroscopy"
      ],
      "year": null
    },
    "source": {
      "title": "Mercury Fact Sheet",
      "org": "NASA NSSDCA",
      "url": "https://nssdc.gsfc.nasa.gov/planetary/factsheet/mercuryfact.html"
    },
    "lastVerified": "2026-10-04",
    "verifiedBy": "agent"
  },
  {
    "id": "mercury.water_ice",
    "worldId": "mercury",
    "label": "Лёд в полярных кратерах",
    "display": "Водяной лёд в вечной тени",
    "value": null,
    "unit": null,
    "uncertainty": null,
    "confidence": "measured",
    "howWeKnow": {
      "summary": "В 2012 году NASA сообщило: зонд MESSENGER нашёл водяной лёд на дне кратеров у полюсов Меркурия, куда никогда не заглядывает Солнце. Доказательства три: избыток водорода, замеченный нейтронным спектрометром; необычный блеск этих мест в лазерном луче альтиметра; расчёты температуры — там всегда достаточно холодно для льда.",
      "missionIds": [
        "messenger"
      ],
      "methodIds": [
        "spectroscopy"
      ],
      "year": 2012
    },
    "source": {
      "title": "MESSENGER Finds New Evidence for Water Ice at Mercury's Poles (press release, 2012-11-29)",
      "org": "NASA NSSDCA",
      "url": "https://nssdc.gsfc.nasa.gov/planetary/text/messenger_pr_20121129.txt"
    },
    "lastVerified": "2026-10-04",
    "verifiedBy": "agent"
  },
  {
    "id": "mercury.lead_melts",
    "worldId": "mercury",
    "label": "Температура плавления свинца",
    "display": "+327,5 °C",
    "value": 327.5,
    "unit": "°C",
    "uncertainty": null,
    "confidence": "measured",
    "howWeKnow": {
      "summary": "Свинец плавится при +327,5 °C — это измерено в земных лабораториях. Днём поверхность Меркурия нагревается примерно до +430 °C, то есть заметно горячее: кусок свинца там расплавился бы.",
      "missionIds": [],
      "methodIds": [],
      "year": null
    },
    "source": {
      "title": "Lead — Melting Point",
      "org": "PubChem, NIH",
      "url": "https://pubchem.ncbi.nlm.nih.gov/compound/5352425"
    },
    "lastVerified": "2026-10-04",
    "verifiedBy": "agent"
  },
  {
    "id": "mercury.sun_size",
    "worldId": "mercury",
    "label": "Солнце в небе Меркурия",
    "display": "В 3 раза больше, в 7 раз ярче",
    "value": null,
    "unit": null,
    "uncertainty": null,
    "confidence": "derived",
    "howWeKnow": {
      "summary": "Меркурий почти в три раза ближе к Солнцу, чем Земля. Поэтому с его поверхности Солнце выглядело бы более чем в три раза больше, а солнечный свет был бы до семи раз ярче. Это вычисляют по расстоянию до Солнца, которое известно очень точно.",
      "missionIds": [],
      "methodIds": [],
      "year": null
    },
    "source": {
      "title": "Mercury: Facts",
      "org": "NASA Science",
      "url": "https://science.nasa.gov/mercury/facts/"
    },
    "lastVerified": "2026-10-04",
    "verifiedBy": "agent"
  },
  {
    "id": "venus.surface_temp",
    "worldId": "venus",
    "label": "Температура поверхности",
    "display": "+464 °C",
    "value": 464,
    "unit": "°C",
    "uncertainty": null,
    "confidence": "measured",
    "howWeKnow": {
      "summary": "Советские спускаемые аппараты «Венера» садились на поверхность и передавали температуру и давление, пока не выходили из строя от жары. Первой это сделала «Венера-7» в 1970 году, а «Венера-9» в 1975-м передала первые снимки с поверхности. Американский «Магеллан» в 1990–1994 годах нанёс рельеф на карту радаром, который видит сквозь облака.",
      "missionIds": [
        "venera7",
        "venera9",
        "magellan"
      ],
      "methodIds": [
        "in_situ",
        "radar"
      ],
      "year": 1970
    },
    "source": {
      "title": "Venus Fact Sheet",
      "org": "NASA NSSDCA",
      "url": "https://nssdc.gsfc.nasa.gov/planetary/factsheet/venusfact.html"
    },
    "lastVerified": "2026-10-04",
    "verifiedBy": "agent"
  },
  {
    "id": "venus.gravity",
    "worldId": "venus",
    "label": "Сила тяжести",
    "display": "0,9 g",
    "value": 0.9,
    "unit": "g",
    "uncertainty": null,
    "confidence": "derived",
    "howWeKnow": {
      "summary": "Массу Венеры точно измерили по движению космических аппаратов на её орбите — по сдвигу частоты их радиосигнала. Зная массу и радиус, вычисляют силу тяжести у поверхности: 8,87 м/с², это 0,9 земной.",
      "missionIds": [
        "magellan"
      ],
      "methodIds": [
        "radio_science"
      ],
      "year": null
    },
    "source": {
      "title": "Venus Fact Sheet",
      "org": "NASA NSSDCA",
      "url": "https://nssdc.gsfc.nasa.gov/planetary/factsheet/venusfact.html"
    },
    "lastVerified": "2026-10-04",
    "verifiedBy": "agent"
  },
  {
    "id": "venus.day",
    "worldId": "venus",
    "label": "Солнечные сутки (от восхода до восхода)",
    "display": "117 земных суток",
    "value": 116.75,
    "unit": "Earth days",
    "uncertainty": null,
    "confidence": "measured",
    "howWeKnow": {
      "summary": "Венера вращается очень медленно и в обратную сторону: один оборот вокруг оси занимает 243 земных суток. Но так как она ещё и идёт по орбите, от восхода до следующего восхода Солнца проходит около 117 земных суток. Здесь показаны именно солнечные сутки. Вращение измерили радаром, ведь поверхность скрыта облаками.",
      "missionIds": [
        "magellan"
      ],
      "methodIds": [
        "radar"
      ],
      "year": null
    },
    "source": {
      "title": "Venus Fact Sheet",
      "org": "NASA NSSDCA",
      "url": "https://nssdc.gsfc.nasa.gov/planetary/factsheet/venusfact.html"
    },
    "lastVerified": "2026-10-04",
    "verifiedBy": "agent"
  },
  {
    "id": "venus.atmosphere",
    "worldId": "venus",
    "label": "Атмосфера",